{
  "schemaVersion": "guide-playbook.v1",
  "guideId": "guide-creative-server-train-shield-candidate-v1",
  "title": "创作体验服列车护盾候选路线（证据不足）",
  "status": "conflicted",
  "applicableGameVersions": [
    "4.4"
  ],
  "archetypeId": "archetype-train-shield-unverified",
  "archetypeName": "列车护盾候选",
  "goalIds": [
    "research_candidate"
  ],
  "signals": {
    "coreCharacterIds": [
      "currency_wars_character_01"
    ],
    "optionalCharacterIds": [
      "currency_wars_character_67"
    ],
    "equipmentIds": [],
    "bondIds": [
      "currency_wars_bond_11",
      "currency_wars_bond_15"
    ],
    "investmentEnvironmentIds": [],
    "investmentStrategyIds": []
  },
  "applicability": {
    "required": [
      {
        "field": "gameVersion",
        "operator": "equals",
        "expected": "4.4",
        "unknownPolicy": "require_review",
        "evidenceRefs": [
          {
            "evidenceSetId": "evidence-bili-bv1jpny6neta",
            "claimId": "metadata-creative-server"
          }
        ]
      }
    ],
    "prohibited": [],
    "defaultUnknownPolicy": "require_review"
  },
  "phases": [
    {
      "phaseId": "manual-review-only",
      "title": "待人工逐段复核",
      "selector": {
        "planeIds": [],
        "nodeIds": [],
        "nodeTypes": [
          "unknown"
        ]
      },
      "recommendedState": {
        "economy": {
          "min": null,
          "max": null,
          "unit": "coin"
        },
        "health": {
          "min": null,
          "max": null,
          "unit": "health"
        },
        "level": {
          "min": null,
          "max": null,
          "unit": "level"
        },
        "remainingActionPoints": {
          "min": null,
          "max": null,
          "unit": "action_point"
        },
        "lineup": {
          "frontCharacterIds": [],
          "backCharacterIds": [],
          "benchCharacterIds": [],
          "minimumStarsByCharacterId": {}
        },
        "equipment": [],
        "bondIds": [
          "currency_wars_bond_11",
          "currency_wars_bond_15"
        ],
        "investmentEnvironmentIds": [],
        "investmentStrategyIds": []
      },
      "actionIds": [
        "do-not-auto-apply"
      ],
      "evidenceRefs": [
        {
          "evidenceSetId": "evidence-bili-bv1jpny6neta",
          "claimId": "coarse-train-shield-route"
        }
      ],
      "notes": [
        "节点、经济、装备和刷新阈值均未可靠取得。"
      ]
    }
  ],
  "actions": [
    {
      "actionId": "do-not-auto-apply",
      "title": "保留为研究候选，不驱动高风险决策",
      "instruction": "在补齐正式服和精确时间点证据前，只展示路线候选及风险，不自动执行购买、出售、刷新或换阵。",
      "priority": 1,
      "conditions": [
        {
          "field": "evidenceConfidence",
          "operator": "less_than",
          "expected": 0.7,
          "unknownPolicy": "require_review",
          "evidenceRefs": [
            {
              "evidenceSetId": "evidence-bili-bv1jpny6neta",
              "claimId": "coarse-train-shield-route"
            }
          ]
        }
      ],
      "benefits": [
        "避免把体验服或粗粒度推断误当成正式服事实"
      ],
      "costs": [
        "暂时不能生成具体操作建议"
      ],
      "risks": [
        "来源之间的适用范围尚未解决"
      ],
      "preconditions": [
        "显示证据不足状态"
      ],
      "invalidatesWhen": [
        "取得正式服多来源逐段证据并完成复核"
      ],
      "fallbackActionIds": [],
      "evidenceRefs": [
        {
          "evidenceSetId": "evidence-bili-bv1jpny6neta",
          "claimId": "coarse-train-shield-route"
        }
      ]
    }
  ],
  "branches": [],
  "alternativeRoutes": [],
  "risks": [
    {
      "riskId": "creative-server-drift",
      "severity": "high",
      "description": "创作体验服数值或机制可能与正式服不同。",
      "mitigation": "保留冲突，标记 unknown，并要求正式服来源交叉验证。",
      "evidenceRefs": [
        {
          "evidenceSetId": "evidence-bili-bv1jpny6neta",
          "claimId": "metadata-creative-server"
        },
        {
          "evidenceSetId": "evidence-bili-bv1jpny6neta",
          "claimId": "coarse-train-shield-route"
        }
      ]
    }
  ],
  "missingInformationPolicy": {
    "defaultBehavior": "require_review",
    "highRiskDecisionBehavior": "never_auto_execute",
    "conflictBehavior": "preserve_all_sources",
    "minimumConfidence": 0.8
  },
  "evidenceRefs": [
    {
      "evidenceSetId": "evidence-bili-bv1jpny6neta",
      "claimId": "metadata-creative-server"
    },
    {
      "evidenceSetId": "evidence-bili-bv1jpny6neta",
      "claimId": "coarse-train-shield-route"
    },
    {
      "evidenceSetId": "evidence-taptap-828363891523190942",
      "claimId": "core-train-shield"
    }
  ],
  "notes": [
    "该例展示未知信息与跨来源冲突如何保留，不代表路线已被验证。"
  ]
}
