{
  "schemaVersion": "guide-playbook.v1",
  "guideId": "guide-taptap-himeko-train-shield-v1",
  "title": "V4.4 姬子·启行列车护盾稳定路线",
  "status": "reviewed",
  "applicableGameVersions": [
    "4.4"
  ],
  "archetypeId": "archetype-himeko-train-shield",
  "archetypeName": "姬子·启行列车护盾",
  "goalIds": [
    "stable"
  ],
  "signals": {
    "coreCharacterIds": [
      "currency_wars_character_01",
      "currency_wars_character_67"
    ],
    "optionalCharacterIds": [
      "currency_wars_character_23",
      "currency_wars_character_55"
    ],
    "equipmentIds": [],
    "bondIds": [
      "currency_wars_bond_11",
      "currency_wars_bond_15"
    ],
    "investmentEnvironmentIds": [],
    "investmentStrategyIds": []
  },
  "applicability": {
    "required": [
      {
        "field": "gameVersion",
        "operator": "equals",
        "expected": "4.4",
        "unknownPolicy": "reject",
        "evidenceRefs": [
          {
            "evidenceSetId": "evidence-taptap-828363891523190942",
            "claimId": "metadata-v44-a850"
          }
        ]
      }
    ],
    "prohibited": [],
    "defaultUnknownPolicy": "require_review"
  },
  "phases": [
    {
      "phaseId": "plane-1-transition",
      "title": "第一位面低费过渡",
      "selector": {
        "planeIds": [
          1
        ],
        "nodeIds": [],
        "nodeTypes": [
          "preparation",
          "battle",
          "boss"
        ]
      },
      "recommendedState": {
        "economy": {
          "min": null,
          "max": null,
          "unit": "coin"
        },
        "health": {
          "min": null,
          "max": null,
          "unit": "health"
        },
        "level": {
          "min": null,
          "max": 6,
          "unit": "level"
        },
        "remainingActionPoints": {
          "min": null,
          "max": null,
          "unit": "action_point"
        },
        "lineup": {
          "frontCharacterIds": [],
          "backCharacterIds": [],
          "benchCharacterIds": [],
          "minimumStarsByCharacterId": {}
        },
        "equipment": [],
        "bondIds": [
          "currency_wars_bond_14",
          "currency_wars_bond_17",
          "currency_wars_bond_12"
        ],
        "investmentEnvironmentIds": [],
        "investmentStrategyIds": []
      },
      "actionIds": [
        "hold-flexible-transition"
      ],
      "evidenceRefs": [
        {
          "evidenceSetId": "evidence-taptap-828363891523190942",
          "claimId": "early-low-cost-transition"
        }
      ],
      "notes": [
        "羁绊只表示可用过渡方向，不要求同时全部激活。"
      ]
    },
    {
      "phaseId": "plane-2-core",
      "title": "第二位面向列车护盾收束",
      "selector": {
        "planeIds": [
          2
        ],
        "nodeIds": [],
        "nodeTypes": [
          "preparation",
          "battle",
          "boss"
        ]
      },
      "recommendedState": {
        "economy": {
          "min": null,
          "max": null,
          "unit": "coin"
        },
        "health": {
          "min": null,
          "max": null,
          "unit": "health"
        },
        "level": {
          "min": null,
          "max": null,
          "unit": "level"
        },
        "remainingActionPoints": {
          "min": null,
          "max": null,
          "unit": "action_point"
        },
        "lineup": {
          "frontCharacterIds": [
            "currency_wars_character_01",
            "currency_wars_character_67"
          ],
          "backCharacterIds": [],
          "benchCharacterIds": [],
          "minimumStarsByCharacterId": {
            "currency_wars_character_01": 1,
            "currency_wars_character_67": 1
          }
        },
        "equipment": [],
        "bondIds": [
          "currency_wars_bond_11",
          "currency_wars_bond_15"
        ],
        "investmentEnvironmentIds": [],
        "investmentStrategyIds": []
      },
      "actionIds": [
        "keep-himeko-and-march"
      ],
      "evidenceRefs": [
        {
          "evidenceSetId": "evidence-taptap-828363891523190942",
          "claimId": "core-train-shield"
        }
      ],
      "notes": []
    }
  ],
  "actions": [
    {
      "actionId": "hold-flexible-transition",
      "title": "用现有低费组件稳定过渡",
      "instruction": "保持可用低费阵容，不为尚未出现的核心角色过度刷新；首个首领前以达到 6 级为阶段目标。",
      "priority": 100,
      "conditions": [
        {
          "field": "plane",
          "operator": "equals",
          "expected": 1,
          "unknownPolicy": "reject",
          "evidenceRefs": [
            {
              "evidenceSetId": "evidence-taptap-828363891523190942",
              "claimId": "early-low-cost-transition"
            }
          ]
        }
      ],
      "benefits": [
        "减少第一位面的无效经济投入"
      ],
      "costs": [
        "当前阵容上限暂时较低"
      ],
      "risks": [
        "过渡组件不足时仍需优先保证生存"
      ],
      "preconditions": [
        "页面已可靠识别为第一位面备战阶段"
      ],
      "invalidatesWhen": [
        "进入第二位面",
        "当前阵容无法稳定过关"
      ],
      "fallbackActionIds": [],
      "evidenceRefs": [
        {
          "evidenceSetId": "evidence-taptap-828363891523190942",
          "claimId": "early-low-cost-transition"
        }
      ]
    },
    {
      "actionId": "keep-himeko-and-march",
      "title": "围绕列车同行与护盾收束",
      "instruction": "确认获得姬子·启行后保留她，并优先寻找三月七及其他列车同行、生存组件。",
      "priority": 90,
      "conditions": [
        {
          "field": "lineupIds",
          "operator": "contains_any",
          "expected": [
            "currency_wars_character_01"
          ],
          "unknownPolicy": "reject",
          "evidenceRefs": [
            {
              "evidenceSetId": "evidence-taptap-828363891523190942",
              "claimId": "core-train-shield"
            }
          ]
        }
      ],
      "benefits": [
        "向来源给出的列车护盾核心收束"
      ],
      "costs": [
        "仍需寻找剩余组件"
      ],
      "risks": [
        "单有核心角色不代表阵容已经成型"
      ],
      "preconditions": [
        "姬子·启行识别置信度可靠"
      ],
      "invalidatesWhen": [
        "正式服机制变更",
        "可靠数据表明当前路线失去生存能力"
      ],
      "fallbackActionIds": [
        "hold-flexible-transition"
      ],
      "evidenceRefs": [
        {
          "evidenceSetId": "evidence-taptap-828363891523190942",
          "claimId": "core-train-shield"
        }
      ]
    }
  ],
  "branches": [],
  "alternativeRoutes": [],
  "risks": [
    {
      "riskId": "author-experience-not-official",
      "severity": "medium",
      "description": "来源是作者经验，不是官方胜率或强度保证。",
      "mitigation": "保留来源与版本，并在实际局势不满足时使用安全降级。",
      "evidenceRefs": [
        {
          "evidenceSetId": "evidence-taptap-828363891523190942",
          "claimId": "core-train-shield"
        }
      ]
    }
  ],
  "missingInformationPolicy": {
    "defaultBehavior": "mark_unknown",
    "highRiskDecisionBehavior": "never_auto_execute",
    "conflictBehavior": "preserve_all_sources",
    "minimumConfidence": 0.7
  },
  "evidenceRefs": [
    {
      "evidenceSetId": "evidence-taptap-828363891523190942",
      "claimId": "metadata-v44-a850"
    },
    {
      "evidenceSetId": "evidence-taptap-828363891523190942",
      "claimId": "core-train-shield"
    },
    {
      "evidenceSetId": "evidence-taptap-828363891523190942",
      "claimId": "early-low-cost-transition"
    }
  ],
  "notes": [
    "本例由项目内已审核 runtime guide 和研究记录迁移。"
  ]
}
